{
  "version": "1.0",
  "project": {
    "name": "Example Reference Translation",
    "objective": "Present the client's studio and lead visitors toward an inquiry.",
    "framework": "astro",
    "rendering": "static",
    "fidelity_target": "high",
    "locales": ["en"]
  },
  "inputs": {
    "style_dna": "STYLE_DNA.json",
    "reference_evidence": "REFERENCE_EVIDENCE.json",
    "content_manifest": "CONTENT_MANIFEST.json",
    "build_brief": "BUILD_BRIEF.md",
    "brand_dna": null,
    "brand_rules": null
  },
  "checkpoints": [
    {
      "id": "brand-manual",
      "status": "waived",
      "artifact": null,
      "reason": "The synthetic example has no separate brand scan.",
      "notes": "Do not infer brand rules from the reference website."
    },
    {
      "id": "reference-lab",
      "status": "approved",
      "artifact": "reference-lab/index.html",
      "notes": "Typography, editorial composition and media sequence were reviewed."
    },
    {
      "id": "content-architecture",
      "status": "approved",
      "artifact": "CONTENT_MANIFEST.json",
      "notes": "The single-page narrative and primary inquiry path were approved."
    }
  ],
  "global_system": {
    "brand_application": {
      "must_preserve": ["client name", "client copy", "client media"],
      "may_adapt": ["copy line breaks", "media crop by viewport"],
      "must_not_introduce": ["reference brand names", "reference proprietary assets"]
    },
    "reference_application": {
      "must_preserve": ["editorial hierarchy", "spatial tension", "behavioral intent"],
      "may_adapt": ["literal section count", "image count"],
      "must_not_copy": ["source code", "logos", "copy", "proprietary media"]
    },
    "navigation": {
      "model": "persistent minimal header",
      "desktop": "Centered route group with inquiry action.",
      "mobile": "Compact trigger with equivalent keyboard and touch access."
    },
    "responsive_strategy": "Preserve hierarchy and focal media while reflowing editorial masses instead of merely stacking columns.",
    "motion_strategy": "Use motion only where evidence supports sequence, direct manipulation or continuity.",
    "accessibility_strategy": "Preserve focus, keyboard access, touch equivalents and meaningful reduced-motion states."
  },
  "pages": {
    "home": {
      "route": "/",
      "purpose": "Establish the studio proposition and lead to the primary inquiry journey.",
      "content_page": "home",
      "reading_path": ["hero proposition", "supporting copy", "primary action"],
      "sections": [
        {
          "id": "hero",
          "content_section": "hero",
          "role": "opening proposition",
          "component": {
            "family": "hero",
            "variant": "editorial-media-sequence",
            "reusable": false,
            "reuse_key": null
          },
          "content_policy": {
            "must_preserve": ["title", "body", "primary CTA", "hero media"],
            "may_condense": false,
            "notes": "Line breaks may adapt, but the proposition and CTA meaning cannot change."
          },
          "reference_patterns": [
            {
              "style_path": "art_direction.summary",
              "application": ["composition", "typography"],
              "mode": "derived",
              "evidence_refs": ["synthetic-editorial-register", "synthetic-media-sequence"],
              "rationale": "The target hero needs the same editorial dominance without reusing the reference content."
            },
            {
              "style_path": "media.sequences.object-process-sequence",
              "application": ["media", "motion"],
              "mode": "adaptive",
              "evidence_refs": ["synthetic-media-sequence"],
              "rationale": "The supplied hero image becomes the first state of a sequence-ready media region."
            }
          ],
          "composition": {
            "dominant_mass": "Large proposition occupying the lower-left visual field.",
            "secondary_mass": "Supporting copy and action aligned to the opposite edge.",
            "alignment_anchors": ["viewport left edge", "lower baseline", "media focal axis"],
            "reading_path": ["media", "headline", "supporting copy", "CTA"],
            "intended_empty_space": "Upper center remains quiet so the headline and media do not compete.",
            "figure_ground": "High-contrast type remains distinct from the active media field.",
            "media_focal_strategy": "Preserve the subject focal point and allow recrop rather than distortion."
          },
          "responsive": {
            "desktop": {
              "layout_intent": "Asymmetric editorial split with simultaneous media and copy.",
              "content_order": ["media", "headline", "supporting copy", "CTA"],
              "media_behavior": "Wide crop preserving the declared focal point."
            },
            "tablet": {
              "layout_intent": "Reduced split retaining visual tension and readable copy measure.",
              "content_order": ["media", "headline", "supporting copy", "CTA"],
              "media_behavior": "Recrop around the focal point without changing aspect arbitrarily."
            },
            "mobile": {
              "layout_intent": "Sequential composition with headline dominance and touch-safe action.",
              "content_order": ["headline", "media", "supporting copy", "CTA"],
              "media_behavior": "Taller crop centered on the declared focal point."
            },
            "transformations": ["reflow", "reorder", "recrop", "motion-reduction"]
          },
          "behaviors": [
            {
              "id": "hero-media-sequence",
              "kind": "continuous-motion",
              "implementation_intent": "Maintain ordered media continuity without replacing it with a generic fade.",
              "desktop": "Sequence advances with the observed continuity and pacing hierarchy.",
              "mobile": "Sequence remains legible at a reduced amplitude and touch-safe pace.",
              "reduced_motion": "Show one stable representative frame with no automatic displacement.",
              "evidence_refs": ["synthetic-media-sequence"]
            }
          ],
          "acceptance": {
            "visual": ["Headline is the dominant painted mass.", "Media is not stretched."],
            "content": ["All supplied hero copy and the primary CTA remain represented."],
            "responsive": ["Mobile preserves hierarchy instead of simply shrinking desktop."],
            "behavior": ["Reduced motion has a stable equivalent."]
          },
          "uncertainties": ["Exact transition timing remains adaptive until the reference lab is measured."
          ]
        }
      ],
      "excluded_content_sections": []
    }
  },
  "decisions": [
    {
      "id": "framework-static-astro",
      "topic": "rendering",
      "decision": "Use static Astro output.",
      "rationale": "The example has editorial content and lightweight interactions with no server-state requirement.",
      "status": "resolved"
    }
  ],
  "approval": {
    "status": "approved",
    "approved_by": "example-reviewer",
    "approved_at": "2026-01-15T12:00:00Z",
    "notes": "Synthetic approved fixture for validator and documentation use."
  }
}
